ID,Título,Autor,Categorías,Fecha,Hora,Vistas,Topico_Final,solo_fecha,dia_semana_es
5644,El INDEC da a conocer la inflación de junio que tendría una leve suba respecto a mayo,Francis Dinatale,"DESTACADAS, INTERÉS GENERAL, Sin Categoria",2025-07-14,09:24:04,2,Precios y costo de vida,2025-07-14,Lunes
5640,El blues llegó al aula: Botafogo ofreció una clase magistral en Villa Rumipal,Jose Manuel Ferrero,"DESTACADAS, INTERÉS GENERAL",2025-07-14,07:11:39,2,Otros,2025-07-14,Lunes
5635,Roatán se prepara para recibir su nuevo Hospital de Emergencia: un salto en el acceso a la salud insular,Jose Manuel Ferrero,"DESTACADAS, HONDURAS",2025-07-14,07:03:37,2,Internacional,2025-07-14,Lunes
5631,Honduras: Protección al Consumidor investiga 400 expedientes con multas millonarias por abusos comerciales,Jose Manuel Ferrero,"DESTACADAS, HONDURAS",2025-07-14,06:57:15,2,Internacional,2025-07-14,Lunes
5627,Tegucigalpa entra al Top 100 de ciudades latinoamericanas según Oxford Economics,Jose Manuel Ferrero,"DESTACADAS, HONDURAS",2025-07-14,06:49:22,2,Internacional,2025-07-14,Lunes
5623,Castro responde a la cancelación del TPS: “Los hondureños afectados no están solos”,Jose Manuel Ferrero,"DESTACADAS, HONDURAS",2025-07-14,06:40:24,2,Internacional,2025-07-14,Lunes
5618,Comienza el Torneo Clausura,Francis Dinatale,"DEPORTES, DESTACADAS",2025-07-11,10:19:39,2,Deportes,2025-07-11,Viernes
5615,Milei ratificó su idea de pelear contra todos,Francis Dinatale,"DESTACADAS, POLITICA",2025-07-11,10:01:50,2,Política,2025-07-11,Viernes
5611,"Revés para el Gobierno el Senado: son ley la suba de jubilaciones, moratoria previsional y emergencia en discapacidad",Francis Dinatale,"DESTACADAS, POLITICA",2025-07-11,09:28:21,2,Política,2025-07-11,Viernes
5608,La Cumbrecita abre su invierno con música y solidaridad,Jose Manuel Ferrero,"DESTACADAS, INTERÉS GENERAL",2025-07-11,06:53:38,4,Clima,2025-07-11,Viernes
5605,La Cumbrecita celebra 29 años como Pueblo Peatonal: un ejemplo de turismo sostenible y bienestar comunitario,Jose Manuel Ferrero,"DESTACADAS, INTERÉS GENERAL",2025-07-11,06:47:35,4,Eventos locales,2025-07-11,Viernes
5602,Embalse vuelve a latir con su Feria de Emprendedores y Artesanos este invierno,Jose Manuel Ferrero,"DESTACADAS, INTERÉS GENERAL",2025-07-11,06:40:52,3,Eventos locales,2025-07-11,Viernes
5599,"Embalse activa su propuesta de invierno: cultura, deporte y naturaleza para todos los gustos",Jose Manuel Ferrero,"DESTACADAS, INTERÉS GENERAL",2025-07-11,06:27:40,3,Eventos locales,2025-07-11,Viernes
5595,Instituto venció a Boca en Córdoba e igualó la final de la Liga Nacional,Francis Dinatale,"DEPORTES, DESTACADAS",2025-07-10,10:48:55,2,Deportes,2025-07-10,Jueves
5591,La presentación de Leandro Paredes en Boca,Francis Dinatale,"DEPORTES, DESTACADAS",2025-07-10,10:44:12,4,Deportes,2025-07-10,Jueves
5588,River pagaría el resarcimiento que pide América de Cali para soltar a Juanfer Quintero,Francis Dinatale,"DEPORTES, DESTACADAS",2025-07-10,10:38:46,2,Deportes,2025-07-10,Jueves
5584,Vicuña Mackenna: La Provincia reclama a Nación la urgente habilitación de la Ruta Nacional 7,Francis Dinatale,"DESTACADAS, INTERÉS GENERAL",2025-07-10,10:26:51,2,Otros,2025-07-10,Jueves
5578,"En Colonia Caroya, Llaryora encabezó el desfile cívico-militar en conmemoración del 9 de Julio",Francis Dinatale,"DESTACADAS, INTERÉS GENERAL",2025-07-10,10:13:49,1,Política,2025-07-10,Jueves
5575,Confirmaron la alianza PRO-La Libertad Avanza para las elecciones en provincia de Buenos Aires,Francis Dinatale,"DESTACADAS, POLITICA",2025-07-10,10:04:07,1,Política,2025-07-10,Jueves
5572,"Fuerza Patria es el nombre de la alianza electoral que acordaron Axel Kicillof, Máximo Kirchner y Sergio Massa",Francis Dinatale,"DESTACADAS, POLITICA",2025-07-10,09:24:23,4,Política,2025-07-10,Jueves
5568,El Senado sesionará este jueves con una agenda opositora que amenaza al gobierno,Francis Dinatale,"DESTACADAS, POLITICA",2025-07-09,10:04:44,2,Política,2025-07-09,Miércoles
5565,Tevez llega de Miami y se hace cargo de Talleres: esta tarde dirigirá la práctica,Francis Dinatale,"DEPORTES, DESTACADAS",2025-07-09,10:00:02,2,Deportes,2025-07-09,Miércoles
5561,Leandro Paredes llegó a Argentina para sumarse a Boca,Francis Dinatale,"DEPORTES, DESTACADAS",2025-07-09,09:56:49,1,Deportes,2025-07-09,Miércoles
5558,Javier Milei no va a Tucumán: el SMN y pronosticadores del tiempo desmienten la versión de Presidencia,Francis Dinatale,"DESTACADAS, POLITICA",2025-07-09,09:46:22,2,Política,2025-07-09,Miércoles
5553,Chelsea y Fluminense se enfrentan en Nueva Jersey por un lugar en la final del Mundial de Clubes,Francis Dinatale,"DEPORTES, DESTACADAS",2025-07-08,10:19:26,1,Deportes,2025-07-08,Martes
5547,Se consolida el crecimiento del mercado de autos usados en Córdoba: se vendieron 110 mil vehículos en el primer semestre,Francis Dinatale,"DESTACADAS, INTERÉS GENERAL",2025-07-08,10:00:46,2,Otros,2025-07-08,Martes
5543,Escándalo de las valijas: el Gobierno cambió la versión y ahora justifica que no se revisaron porque hubo “controles en Estados Unidos”,Francis Dinatale,"DESTACADAS, NACIONALES, POLITICA",2025-07-08,09:34:46,2,Política,2025-07-08,Martes
5540,El Gobierno eliminó el Instituto Nacional del Cáncer y el de las Enfermedades Cardiovasculares,Francis Dinatale,Sin Categoria,2025-07-08,09:29:55,1,Política,2025-07-08,Martes
5535,Provincia amplía la terapia intensiva del Hospital de Niños con una inversión récord de $1.300 millones,Francis Dinatale,"DESTACADAS, INTERÉS GENERAL",2025-07-08,09:25:43,1,Salud,2025-07-08,Martes
5532,Gran desempeño de los embalseños en la cantera de San Agustín,Jose Manuel Ferrero,"DEPORTES, DESTACADAS",2025-07-08,07:07:44,4,Deportes,2025-07-08,Martes
5529,Vibrante cierre de la Asociación Calamuchitana de Vóley en Embalse,Jose Manuel Ferrero,"DEPORTES, DESTACADAS",2025-07-08,06:56:42,3,Deportes,2025-07-08,Martes
5526,Bautista Prado se destaca entre los mejores del país en el Nacional Sub 16,Jose Manuel Ferrero,"DEPORTES, DESTACADAS",2025-07-08,06:34:55,3,Deportes,2025-07-08,Martes
